{
  "task_id": "task_backfill_20260804_extract_official",
  "pr_number": 92,
  "rounds": [
    {
      "round": 1,
      "reviewed_at": "2026-08-05T18:10:00Z",
      "reviewer_run_id": "run_20260805T180500Z_contloop",
      "checks": [
        "scope",
        "provenance",
        "deduplication",
        "temporal_precision",
        "modality",
        "safety",
        "tests",
        "coverage_gaps"
      ],
      "findings": [
        "All changed paths are the task manifest or declared output paths.",
        "Each of the eight observations is atomic, draft-only, attributed to its stored source entity, and uses an original-language excerpt and exact locator from the corresponding raw manifest.",
        "No event-time range was invented where the stored records did not provide a sufficiently bounded timestamp for the asserted event.",
        "Russian MoD summary item item_20260804_mod_66271 was reviewed but correctly omitted as a separate observation because its recorded upstream_item_ids repeat earlier assigned posts.",
        "No external evidence, final truth assessment, source reliability score, precise operational location, or targeting-enabling detail was introduced.",
        "GitHub Actions run 31033304767 passed unit tests and all repository, queue, autonomy, proposal, and live-ref validators on head 90d660c1b5f01dbbc2548971b56ddcf58dc59a5e."
      ],
      "repairs": [],
      "outcome": "pass"
    },
    {
      "round": 2,
      "reviewed_at": "2026-08-05T18:11:00Z",
      "reviewer_run_id": "run_20260805T180500Z_contloop",
      "checks": [
        "scope",
        "provenance",
        "deduplication",
        "temporal_precision",
        "modality",
        "safety",
        "tests",
        "coverage_gaps"
      ],
      "findings": [
        "A fresh reread of the task, assigned source-item records, both raw manifests, and the complete PR diff found no blocking or non-blocking defect.",
        "Observation identifiers, source-item references, speaker IDs, languages, excerpts, locators, and draft statuses are internally consistent and schema-conformant.",
        "The statements preserve source attribution and claim modality rather than presenting the official assertions as independently verified facts.",
        "The empty proposal receipt is intentional because the downstream graph was pre-materialized, and all known evidence and lineage limitations are retained in the task coverage gaps."
      ],
      "repairs": [],
      "outcome": "pass"
    }
  ],
  "exceptional_condition": false
}
