{
  "task_id": "task_auto_5ba69fbdf442930f",
  "pr_number": 73,
  "rounds": [
    {
      "round": 1,
      "reviewed_at": "2026-08-05T12:26:00Z",
      "reviewer_run_id": "run_20260805T122130Z_5ba69fbd",
      "checks": [
        "scope",
        "provenance",
        "deduplication",
        "temporal_precision",
        "safety",
        "tests",
        "coverage_gaps"
      ],
      "findings": [
        "The diff is limited to the named source profile, the required downstream proposal receipt, and task control metadata; no unrelated source or research record is changed.",
        "Kyiv's official portal identifies Vitali Klitschko as Kyiv mayor and head of the Kyiv City State Administration and explicitly lists https://t.me/vitaliy_klitschko as his official Telegram channel.",
        "The public Telegram presentation uses the verified display name Віталій Кличко and handle @vitaliy_klitschko, matching the canonical source entity and the two existing source-item records.",
        "Identity and public access are supported by primary public references; historical accuracy, methodology transparency, correction behavior, and independence are not established and remain unknown.",
        "No reliability conclusion, political judgment, reputational assessment, new event claim, geolocation, or operational detail was introduced.",
        "The empty proposal list is appropriate because the bounded identity review found no ambiguity or unresolved task requiring a new downstream duty.",
        "Repository unit tests and all data, queue-reference, worker-queue, autonomy, and work-ref validations passed on the reviewed PR head."
      ],
      "repairs": [],
      "outcome": "pass"
    },
    {
      "round": 2,
      "reviewed_at": "2026-08-05T12:26:30Z",
      "reviewer_run_id": "run_20260805T122130Z_5ba69fbd",
      "checks": [
        "scope",
        "provenance",
        "deduplication",
        "temporal_precision",
        "safety",
        "tests",
        "coverage_gaps"
      ],
      "findings": [
        "A separate reread of the immutable task contract, source-profile schema, primary public references, existing source-item lineage, and complete PR diff found no remaining contract violation.",
        "The aliases, Telegram handle, official biography URL, affiliation relationship, and evidence URLs refer to the same named source entity without creating a duplicate profile.",
        "The assessment is explicitly topic-scoped and time-scoped; only identity and access are rated high, while every unsupported evaluative dimension remains unknown.",
        "Approval denotes completion of the identity record review and does not convert the channel's statements into verified facts or independent corroboration.",
        "Coverage remains limited to public identity and official-account ownership evidence; post-level accuracy and source behavior over time were not assessed.",
        "No exceptional condition requiring human review was identified."
      ],
      "repairs": [],
      "outcome": "pass"
    }
  ],
  "exceptional_condition": false
}
