{
  "task_id": "task_backfill_20260805_10_reactions_corrections",
  "pr_number": 125,
  "rounds": [
    {
      "round": 1,
      "reviewed_at": "2026-08-06T06:49:00Z",
      "reviewer_run_id": "run_20260806T064900Z_reac10_review1",
      "checks": ["scope", "provenance", "deduplication", "temporal_precision", "safety", "tests", "coverage_gaps"],
      "findings": [
        "The material result is limited to the immutable task manifest, four declared discovery outputs, the exact task-specific proposal receipt, and this exact task-specific self-review receipt.",
        "The source-profile, source-item, and artifact outputs are intentionally empty; the raw manifest records six checked surfaces, six search queries, six exclusion classes, three access-failure classes, and an explicit formal-correction search result.",
        "The Guardian Kyiv article remains represented only by item_20260805_guardian_air_defence_criticism; no duplicate identity or cross-shard timestamp rewrite was created.",
        "The current Guardian publication line conflicts with the existing stored timestamp, but no immutable first-published page or formal correction notice resolves the drift.",
        "The AP same-day reaction article remains excluded because exact publication time is unavailable; no event, crawl, retrieval, or dateline time was substituted.",
        "July Reuters and Guardian correction notices and reaction material already represented in media, official, or diplomacy shards remain explicit out-of-window or duplicate exclusions.",
        "Repository validation run 31078402272 passed all 84 tests and repository contract validators on the pre-review material head."
      ],
      "repairs": [],
      "outcome": "pass"
    },
    {
      "round": 2,
      "reviewed_at": "2026-08-06T06:50:00Z",
      "reviewer_run_id": "run_20260806T065000Z_reac10_review2",
      "checks": ["scope", "provenance", "deduplication", "temporal_precision", "safety", "tests", "coverage_gaps"],
      "findings": [
        "A fresh independent pass confirmed that every changed path is either declared by the immutable task contract or is an exact task-specific derived proposal or review receipt.",
        "No admitted record lacks provenance because no record was admitted; every checked surface has an access URL, bounded outcome, and explicit reason for non-admission or duplicate exclusion.",
        "The zero-result statement is narrowly scoped to failure to verify a new formal correction, clarification, retraction, rebuttal, or distinct reaction identity and does not assert that no reaction was published.",
        "The assigned interval is stated consistently as 2026-08-05T05:00:00Z through 2026-08-06T00:00:00Z, while all named stable correction notices are explicitly out of window or already represented.",
        "Mutable-page history, missing AP timestamp, correction-index lag, social-first publication, cross-shard overlap, and absent immutable artifacts remain visible coverage gaps.",
        "The empty catalog, artifact stream, and proposal receipt are consistent with finding no justified new profile, immutable correction artifact, or admissible identity requiring downstream work.",
        "No reliability judgment, correction adjudication, observation, claim, policy conclusion, assessment, or report narrative was created."
      ],
      "repairs": [],
      "outcome": "pass"
    }
  ],
  "exceptional_condition": false
}
