{
  "task_id": "task_backfill_20260805_02_ru_official",
  "pr_number": 117,
  "rounds": [
    {
      "round": 1,
      "reviewed_at": "2026-08-06T05:59:00Z",
      "reviewer_run_id": "run_20260806T055900Z_ruoff02_review1",
      "checks": [
        "scope",
        "provenance",
        "deduplication",
        "temporal_precision",
        "safety",
        "tests",
        "coverage_gaps"
      ],
      "findings": [
        "The material result is limited to the task manifest, four declared discovery outputs, the task-specific proposal receipt, and this task-specific self-review receipt.",
        "The source-item and artifact streams are intentionally empty; the raw manifest records five official surfaces, six exact-date query forms, three excluded candidate classes, three access failures, and explicit zero-result limitations.",
        "Previously collected Ministry of Defence Telegram identifiers 66272 and 66273 are explicitly excluded as duplicates from the completed 00:00–05:00 UTC interval.",
        "No historical 2022–2024 calendar-date result or older July 2026 MAX result is represented as an in-window 5 August 2026 publication.",
        "No sequential Telegram identifier, inferred timestamp, current position, movement route, target coordinate, vulnerable facility, or attached media was persisted.",
        "Repository validation run 31075233302 passed the test suite and all repository contract validators on the pre-review material head.",
        "Coverage gaps distinguish a bounded zero-item outcome from evidence that no official publications existed and preserve index latency, preview incompleteness, absent edit history, and absent immutable artifacts."
      ],
      "repairs": [],
      "outcome": "pass"
    },
    {
      "round": 2,
      "reviewed_at": "2026-08-06T06:00:00Z",
      "reviewer_run_id": "run_20260806T060000Z_ruoff02_review2",
      "checks": [
        "scope",
        "provenance",
        "deduplication",
        "temporal_precision",
        "safety",
        "tests",
        "coverage_gaps"
      ],
      "findings": [
        "A fresh independent pass confirmed that every changed path is either declared by the immutable task contract or is an exact task-specific derived proposal or review receipt.",
        "No source item lacks provenance because no source item was admitted; every searched surface has an access URL, status, and result or failure explanation in the raw manifest.",
        "The zero-result conclusion is narrowly phrased: approved public-web discovery did not resolve a qualifying canonical item, not that Russian institutions made no statements.",
        "The assigned interval is stated consistently as 2026-08-05T05:00:00Z through 2026-08-06T00:00:00Z and no out-of-window record is included.",
        "The empty catalog is consistent with finding no justified new source profile; the empty proposal receipt avoids duplicating downstream work without admissible source items.",
        "The retained text contains no final truth assessment, reliability score, territorial conclusion, atomic observation, claim, map, or report narrative.",
        "No unresolved material defect remains after the separate scope, provenance, deduplication, temporal, safety, validation, and coverage-gap review."
      ],
      "repairs": [],
      "outcome": "pass"
    }
  ],
  "exceptional_condition": false
}
