{
  "task_id": "task_20260805_08_visual_osint_maps",
  "pr_number": 51,
  "rounds": [
    {
      "round": 1,
      "reviewed_at": "2026-08-05T10:41:10Z",
      "reviewer_run_id": "run_20260805T103412Z_250f50e1",
      "checks": [
        "scope",
        "provenance",
        "deduplication",
        "temporal_precision",
        "safety",
        "tests",
        "coverage_gaps"
      ],
      "findings": [],
      "repairs": [],
      "outcome": "pass"
    },
    {
      "round": 2,
      "reviewed_at": "2026-08-05T10:41:22Z",
      "reviewer_run_id": "run_20260805T103412Z_250f50e1",
      "checks": [
        "scope",
        "provenance",
        "deduplication",
        "temporal_precision",
        "safety",
        "tests",
        "coverage_gaps"
      ],
      "findings": [],
      "repairs": [],
      "outcome": "pass"
    }
  ],
  "exceptional_condition": false
}
