{
  "task_id": "task_backfill_20260805_06_military_analysts",
  "pr_number": 121,
  "rounds": [
    {
      "round": 1,
      "reviewed_at": "2026-08-06T06:24:00Z",
      "reviewer_run_id": "run_20260806T062400Z_mila06_review1",
      "checks": [
        "scope",
        "provenance",
        "deduplication",
        "temporal_precision",
        "safety",
        "tests",
        "coverage_gaps"
      ],
      "findings": [
        "The material result is limited to the immutable task manifest, four declared discovery outputs, the exact task-specific proposal receipt, and this exact task-specific self-review receipt.",
        "The source-profile, source-item, and artifact outputs are intentionally empty; the raw manifest records six primary analyst surfaces, ten exact-date queries, five exclusion classes, three access-failure classes, and explicit zero-result limitations.",
        "The earlier unresolved August 3 ISW lead is referenced only as prior campaign lineage and is not duplicated or promoted into the assigned 5 August recovery window.",
        "RUSI July 7 and July 28 publications and the April War on the Rocks article remain explicit out-of-window leads rather than substitutes for missing exact-date material.",
        "Reuters and other media articles containing analyst commentary remain excluded as secondary-source overlap with the international-media shard.",
        "No relay timestamp, search-result date, inferred identifier, primary-page guess, map, full text, binary media, current position, route, or target detail was persisted.",
        "Repository validation run 31077021505 passed all tests and repository contract validators on the pre-review material head."
      ],
      "repairs": [],
      "outcome": "pass"
    },
    {
      "round": 2,
      "reviewed_at": "2026-08-06T06:25:00Z",
      "reviewer_run_id": "run_20260806T062500Z_mila06_review2",
      "checks": [
        "scope",
        "provenance",
        "deduplication",
        "temporal_precision",
        "safety",
        "tests",
        "coverage_gaps"
      ],
      "findings": [
        "A fresh independent pass confirmed that every changed path is either declared by the immutable task contract or is an exact task-specific derived proposal or review receipt.",
        "No admitted record lacks provenance because no record was admitted; every checked surface has an access URL, bounded outcome, and reason for non-admission.",
        "The zero-result statement is narrowly scoped to failure to resolve a qualifying primary publication through approved public-web discovery and does not assert that analysts published nothing.",
        "The assigned interval is stated consistently as 2026-08-05T05:00:00Z through 2026-08-06T00:00:00Z, and all named substantive publications are explicitly excluded as earlier than that interval.",
        "Search-index lag, historical direct-access restrictions, absent primary timestamps, selected-source coverage, and absent immutable artifacts remain visible coverage gaps.",
        "The empty catalog and empty proposal receipt are consistent with finding no justified new source profile or admissible item requiring downstream work.",
        "No reliability score, analytical judgment, observation, claim, territorial conclusion, map product, or report narrative was created."
      ],
      "repairs": [],
      "outcome": "pass"
    }
  ],
  "exceptional_condition": false
}
