{
  "task_id": "task_backfill_20260805_05_international_media",
  "pr_number": 120,
  "rounds": [
    {
      "round": 1,
      "reviewed_at": "2026-08-06T06:16:00Z",
      "reviewer_run_id": "run_20260806T061600Z_intl05_review1",
      "checks": [
        "scope",
        "provenance",
        "deduplication",
        "temporal_precision",
        "safety",
        "tests",
        "coverage_gaps"
      ],
      "findings": [
        "The material result is limited to the task manifest, four declared discovery outputs, the exact task-specific proposal receipt, and this exact task-specific self-review receipt.",
        "The initial material pass admitted three URLs, but validation run 31076516325 found that the Guardian Kyiv canonical URL was already globally represented by item_20260805_guardian_air_defence_criticism in reactions-corrections.ndjson.",
        "The duplicate record was removed rather than renamed or retained under a second source-item identity.",
        "The current Guardian page displays first publication metadata that differs from the existing canonical record; without immutable earlier page bytes, the discrepancy is preserved as unresolved metadata drift rather than rewritten across shard ownership.",
        "The remaining Reuters and Guardian Leipzig records have stable canonical URLs, minute-level UTC publication timestamps, retrieval times, source identities, language, access method, and explicit copyright and revision limitations.",
        "AP was excluded because exact publication time was unavailable, BBC was not bypassed around robots restrictions, and the Guardian live blog was excluded as overlapping rolling lineage.",
        "Validation run 31076631977 passed all 84 tests and repository contract validators after the duplicate repair."
      ],
      "repairs": [
        "Removed item_20260805_guardian_kyiv_air_defence_backfill from the source-item stream.",
        "Updated the raw manifest to reference the existing canonical Guardian identity, preserve the conflicting timestamp metadata, and reduce the admitted result to two new publications."
      ],
      "outcome": "pass"
    },
    {
      "round": 2,
      "reviewed_at": "2026-08-06T06:17:00Z",
      "reviewer_run_id": "run_20260806T061700Z_intl05_review2",
      "checks": [
        "scope",
        "provenance",
        "deduplication",
        "temporal_precision",
        "safety",
        "tests",
        "coverage_gaps"
      ],
      "findings": [
        "A fresh independent pass confirmed that every changed path is either declared by the immutable task contract or is an exact task-specific derived proposal or review receipt.",
        "The source-item stream and raw manifest agree on exactly two new identities: the Reuters EU frozen-assets support article at 08:35 UTC and the Guardian Leipzig analysis at 17:32 UTC.",
        "Reuters publication metadata is explicitly displayed in UTC; Guardian CEST publication and modification times were converted using the applicable UTC+02:00 offset and first publication remains distinct from the later 6 August modification.",
        "No canonical URL, platform identifier, or source-item identity duplicates the earlier international-media campaign or another repository shard.",
        "The existing Guardian Kyiv record remains the sole canonical identity despite unresolved current-page timestamp drift, and no cross-shard mutation was attempted.",
        "No full article body, binary media, map geometry, precise operational location, target detail, truth assessment, observation, claim, territorial conclusion, or report narrative was persisted.",
        "The bounded two-outlet result, AP timestamp gap, BBC robots restriction, mutable page history, incomplete upstream lineage, and absent immutable artifacts remain explicit coverage gaps."
      ],
      "repairs": [],
      "outcome": "pass"
    }
  ],
  "exceptional_condition": false
}
