{
  "task_id": "task_backfill_20260804_extract_media",
  "pr_number": 94,
  "rounds": [
    {
      "round": 1,
      "reviewed_at": "2026-08-05T18:58:00Z",
      "reviewer_run_id": "run_20260805T185100Z_contloop",
      "checks": [
        "scope",
        "provenance",
        "atomicity",
        "deduplication",
        "temporal_precision",
        "derivative_lineage",
        "paywall_handling",
        "safety",
        "tests",
        "coverage_gaps"
      ],
      "findings": [
        "All initial changed paths were the task manifest or declared output paths.",
        "Every assigned source item was reviewed against its frozen source-item record and one or more stored raw manifests.",
        "The Reuters warehouse and Associated Press drone observations each combined the event assertion with a separate clause about upstream attribution, reducing atomicity.",
        "The Financial Times item was correctly omitted because the repository contained only paywalled title metadata and no permitted substantive excerpt or artifact.",
        "No final truth assessment, source reliability score, access-control bypass, precise operational position, or targeting-enabling detail was introduced.",
        "GitHub Actions run 31037090551 passed validator tests, canonical watchlist validation, repository/raw-manifest validation, scope validation, queue/trust-boundary validation, autonomy/proposal validation, and live-ref audit on head 04c75b5b9ec07ea4852df1373aba6614853b0d35."
      ],
      "repairs": [
        "Removed the secondary attribution clause from obs_20260804_reuters_three_warehouses so the canonical statement expresses only the warehouse-strike report.",
        "Removed the secondary attribution clause from obs_20260804_ap_drones_near_moscow_petersburg so the canonical statement expresses only the reported drone attacks."
      ],
      "outcome": "pass"
    },
    {
      "round": 2,
      "reviewed_at": "2026-08-05T19:00:00Z",
      "reviewer_run_id": "run_20260805T185100Z_contloop",
      "checks": [
        "scope",
        "provenance",
        "atomicity",
        "deduplication",
        "temporal_precision",
        "derivative_lineage",
        "paywall_handling",
        "safety",
        "tests",
        "coverage_gaps"
      ],
      "findings": [
        "A fresh reread of the repaired complete PR diff, all 14 assigned source-item records, and the five relevant raw manifests found no blocking or non-blocking defect.",
        "All 16 observation identifiers, source-item references, types, excerpts, languages, locators, canonical statements, event-time handling, and draft statuses are internally consistent and schema-conformant.",
        "Media reports, official assertions relayed by media, reactions, assessments, and verification limitations remain clearly distinguished rather than upgraded into verified facts.",
        "Reuters, AP, Guardian, and Suspilne derivative or upstream limitations are retained in locators and task coverage gaps; repetition is not represented as independent corroboration.",
        "GitHub Actions run 31037210385 passed the full repository validation suite on repaired head 95c06f7ec5c40775d25370a4b6c75b214aa68cf1."
      ],
      "repairs": [],
      "outcome": "pass"
    }
  ],
  "exceptional_condition": false
}
