{
  "task_id": "task_20260805_07_strikes_infrastructure",
  "pr_number": 49,
  "rounds": [
    {
      "round": 1,
      "reviewed_at": "2026-08-05T10:40:45Z",
      "reviewer_run_id": "run_20260805T103403Z_5f7a2c91",
      "checks": [
        "scope",
        "provenance",
        "deduplication",
        "temporal_precision",
        "safety",
        "tests",
        "coverage_gaps"
      ],
      "findings": [
        "No blocking defects found. The data-plane changes are limited to the four declared task outputs, and the only additional paths are the required proposal and self-review receipts.",
        "Both retained Telegram posts have stable canonical post IDs, documented Kyiv-summer-time to UTC normalization, explicit attribution, and incident-update lineage.",
        "The Reuters and DSNS records already present on main are excluded by canonical URL or platform ID rather than duplicated.",
        "No binaries, actionable target-direction data, precise sensitive-site locations, final truth assessment, or report narrative were added.",
        "GitHub Actions run 30998369643 passed validator tests, repository/raw-manifest validation, queue/trust-boundary validation, proposal validation, and live-ref audit on head 0e58929eb93e67791eb7c2b73bebc218bcd78b6e."
      ],
      "repairs": [],
      "outcome": "pass"
    },
    {
      "round": 2,
      "reviewed_at": "2026-08-05T10:41:03Z",
      "reviewer_run_id": "run_20260805T103403Z_5f7a2c91",
      "checks": [
        "scope",
        "provenance",
        "deduplication",
        "temporal_precision",
        "safety",
        "tests",
        "coverage_gaps"
      ],
      "findings": [
        "Second independent reread of the complete branch diff found no blocking or non-blocking defects.",
        "Source-profile fields, source-item references, revision linkage, proposal dependencies, identifiers, canonical URLs, timestamps, retrieval times, and coverage-gap disclosures are internally consistent.",
        "The empty artifact dataset is intentional and agrees with the raw manifest and rights/safety handling.",
        "The result remains discovery-only and makes no corroboration, casualty verification, weapon-effect, interception-performance, targeting-intent, or attribution judgment."
      ],
      "repairs": [],
      "outcome": "pass"
    }
  ],
  "exceptional_condition": false
}
