{
  "task_id": "task_auto_b3f0b5dc016eb465",
  "pr_number": 134,
  "rounds": [
    {
      "round": 1,
      "reviewed_at": "2026-08-06T08:02:20Z",
      "reviewer_run_id": "run_20260806T080220Z_klitschko_review_1",
      "checks": [
        "scope",
        "provenance",
        "deduplication",
        "temporal_precision",
        "safety",
        "tests",
        "coverage_gaps",
        "canonical_identity",
        "correction_lineage",
        "raw_manifest_consistency"
      ],
      "findings": [
        "Canonical source-item IDs and Telegram platform IDs 7127 and 7134 remain unchanged and globally unique.",
        "The August source-item and observation shards are empty, while the same identities occur once in the July correction shards.",
        "Post 7127 is normalized from 00:20 Kyiv summer time to 2026-07-18T21:20:00Z; post 7134 is anchored by Kyiv's official portal at 2026-07-19T06:26:00Z.",
        "The original August raw manifest now treats both posts as historical date collisions."
      ],
      "repairs": [
        "Re-rooted the worker branch on the materialized task commit to eliminate an add/add manifest conflict.",
        "Moved both source items and derived observations to the July correction chronology without changing identifiers.",
        "Withdrew the two affected casualty claims and the approved casualty-reporting assessment.",
        "Preserved all Guardian-derived claims and assessments byte-for-byte."
      ],
      "outcome": "pass"
    },
    {
      "round": 2,
      "reviewed_at": "2026-08-06T08:02:30Z",
      "reviewer_run_id": "run_20260806T080230Z_klitschko_review_2",
      "checks": [
        "scope",
        "provenance",
        "deduplication",
        "temporal_precision",
        "safety",
        "tests",
        "coverage_gaps",
        "fresh_complete_diff",
        "report_input_exclusion",
        "lineage_graph",
        "definition_of_done"
      ],
      "findings": [
        "A fresh diff confirms no positive 5 August claim or approved assessment remains for the fifteen-injured/nine-hospitalized figures.",
        "The approved date-collision correction remains outside the 5 August event window and cannot reintroduce the casualty figures as positive report evidence.",
        "All source-item, observation, claim, and assessment references resolve after relocation; lineage-cycle validation passed.",
        "No medical identifiers, precise impact coordinates, or targeting-enabling details were added."
      ],
      "repairs": [],
      "outcome": "pass"
    }
  ],
  "exceptional_condition": false
}
