{
  "task_id": "task_backfill_20260805_09_diplomacy_support_sanctions",
  "pr_number": 124,
  "rounds": [
    {
      "round": 1,
      "reviewed_at": "2026-08-06T06:44:00Z",
      "reviewer_run_id": "run_20260806T064400Z_dipl09_review1",
      "checks": ["scope", "provenance", "deduplication", "temporal_precision", "safety", "tests", "coverage_gaps"],
      "findings": [
        "The material result is limited to the immutable task manifest, four declared discovery outputs, the exact task-specific proposal receipt, and this exact task-specific self-review receipt.",
        "The source-profile, source-item, and artifact outputs are intentionally empty; the raw manifest records nine official surfaces, eleven exact-date queries, five exclusion classes, three access-failure classes, and explicit zero-result limitations.",
        "The Reuters frozen-assets article remains represented only by item_20260805_reuters_frozen_assets_support_backfill in the merged international-media shard.",
        "The Reuters publication time was not substituted for the unresolved European Commission statement's primary publication time, and no inferred Commission canonical URL was created.",
        "April 2026 Commission material and May or June UK support and sanctions releases remain explicit out-of-window exclusions.",
        "No secondary article, relay timestamp, full text, binary artifact, current position, route, target, or vulnerable-facility detail was persisted.",
        "Repository validation run 31078084548 passed all 84 tests and repository contract validators on the pre-review material head."
      ],
      "repairs": [],
      "outcome": "pass"
    },
    {
      "round": 2,
      "reviewed_at": "2026-08-06T06:45:00Z",
      "reviewer_run_id": "run_20260806T064500Z_dipl09_review2",
      "checks": ["scope", "provenance", "deduplication", "temporal_precision", "safety", "tests", "coverage_gaps"],
      "findings": [
        "A fresh independent pass confirmed that every changed path is either declared by the immutable task contract or is an exact task-specific derived proposal or review receipt.",
        "No admitted record lacks provenance because no record was admitted; each official surface has an access URL, bounded outcome, and explicit reason for non-admission.",
        "The zero-result statement is narrowly scoped to failure to resolve a new qualifying official publication and does not assert that no diplomatic, support, or sanctions statement was issued.",
        "The assigned interval is stated consistently as 2026-08-05T05:00:00Z through 2026-08-06T00:00:00Z, while every named stable official lead is explicitly out of window or already represented elsewhere.",
        "Official index lag, social-first publication, missing primary timestamp, selected-country coverage, and absent immutable artifacts remain visible coverage gaps.",
        "The empty catalog and proposal receipt are consistent with finding no justified new profile or admissible official item requiring downstream work.",
        "No diplomatic, sanctions, support, reliability, policy, observation, claim, assessment, or report narrative was created."
      ],
      "repairs": [],
      "outcome": "pass"
    }
  ],
  "exceptional_condition": false
}
