{
  "task_id": "task_daily_20260805_95_translate_ru",
  "pr_number": 137,
  "rounds": [
    {
      "round": 1,
      "reviewed_at": "2026-08-06T09:02:00Z",
      "reviewer_run_id": "run_20260806T090000Z_continuous_loop",
      "checks": [
        "scope",
        "provenance",
        "deduplication",
        "temporal_precision",
        "safety",
        "tests",
        "coverage_gaps",
        "source_report_integrity",
        "translation_fidelity",
        "public_style",
        "manifest_consistency"
      ],
      "findings": [
        "The material diff is limited to the task manifest and its four declared output paths: Russian report manifest, Russian Markdown, empty proposal receipt, and self-review receipt.",
        "The Russian manifest preserves report type, UTC period, as-of time, the three claim IDs, one assessment ID, and claim-set SHA-256 from rpt_daily_20260805_en.",
        "translation_of_report_id is rpt_daily_20260805_en and source_commit exactly equals the finalized English report merge SHA 9d67be2ff45dbd3c3baab0b41a46f837976e4c04.",
        "The Russian prose preserves the source structure, Guardian attribution, additional-air-defence and sanctions wording, and the distinction between confirmed media attribution and probable underlying statements.",
        "No internal identifiers, hashes, task mechanics, precise operational locations, or targeting-enabling detail appear in public Markdown.",
        "Validate repository contracts run 31087315234 and Build static publication site run 31087315881 passed on the material translation head.",
        "The empty proposal receipt correctly closes the downstream graph."
      ],
      "repairs": [],
      "outcome": "pass"
    },
    {
      "round": 2,
      "reviewed_at": "2026-08-06T09:03:00Z",
      "reviewer_run_id": "run_20260806T090000Z_continuous_loop",
      "checks": [
        "scope",
        "provenance",
        "deduplication",
        "temporal_precision",
        "safety",
        "tests",
        "coverage_gaps",
        "fresh_complete_diff",
        "source_report_integrity",
        "manifest_content_alignment",
        "definition_of_done"
      ],
      "findings": [
        "A fresh complete-diff pass found only one Russian manifest, one reader-facing Russian report, one valid empty downstream proposal, this two-round receipt, and the task lifecycle update.",
        "Dates, report selection, attribution, certainty, unresolved primary-publication identity, and all audit fields remain aligned with the merged English source.",
        "The translation neither converts Guardian reporting into independent primary confirmation nor strengthens probable statements into facts.",
        "No browsing, new evidence, correction, analytical update, or ambiguity resolution was introduced.",
        "Coverage gaps explicitly inherit the English limitations and do not claim an independent assessment by the translator.",
        "No PR comments, review submissions, or unresolved review threads were present during the fresh pass.",
        "The translation task satisfies its bounded definition of done and no exceptional condition remains."
      ],
      "repairs": [],
      "outcome": "pass"
    }
  ],
  "exceptional_condition": false
}
