{
  "task_id": "task_backfill_20260805_08_visual_osint_maps",
  "pr_number": 123,
  "rounds": [
    {
      "round": 1,
      "reviewed_at": "2026-08-06T06:35:00Z",
      "reviewer_run_id": "run_20260806T063500Z_vosm08_review1",
      "checks": ["scope", "provenance", "deduplication", "temporal_precision", "safety", "tests", "coverage_gaps"],
      "findings": [
        "The material result is limited to the immutable task manifest, four declared discovery outputs, the exact task-specific proposal receipt, and this exact task-specific self-review receipt.",
        "The source-profile, source-item, and artifact outputs are intentionally empty; the raw manifest records five visual-OSINT surfaces, eight exact-date query forms, five exclusion classes, three access-failure classes, and explicit zero-result limitations.",
        "DeepState candidate messages 23714, 23715, and 23718 remain unadmitted because their available public representation does not verify publication in the assigned interval.",
        "Indexed rolling-page context exposed map updates and granular locality claims associated with earlier material; no clock time or post sequence was treated as proof of 5 August 2026.",
        "GeoConfirmed client data was not extracted, War Mapper and ISW/CTP older pages were not substituted, and no secondary map article was promoted to primary visual evidence.",
        "No image, video, map tile, geometry, coordinate, active position, route, territorial proposition, or targeting-enabling detail was persisted.",
        "Repository validation run 31077712082 passed all 84 tests and repository contract validators on the pre-review material head."
      ],
      "repairs": [],
      "outcome": "pass"
    },
    {
      "round": 2,
      "reviewed_at": "2026-08-06T06:36:00Z",
      "reviewer_run_id": "run_20260806T063600Z_vosm08_review2",
      "checks": ["scope", "provenance", "deduplication", "temporal_precision", "safety", "tests", "coverage_gaps"],
      "findings": [
        "A fresh independent pass confirmed that every changed path is either declared by the immutable task contract or is an exact task-specific derived proposal or review receipt.",
        "No admitted record lacks provenance because no record was admitted; each checked surface has an access URL, bounded outcome, and explicit reason for non-admission.",
        "The zero-result statement is narrowly scoped to failure to resolve a date-verifiable, safe, stable visual-OSINT publication and does not assert that no map update existed.",
        "The assigned interval is stated consistently as 2026-08-05T05:00:00Z through 2026-08-06T00:00:00Z, while all named stable substantive pages are explicitly out of window or unavailable.",
        "Rolling-page timestamps, absent immutable revisions, unavailable client data, selected-source coverage, and deliberate geometry exclusions remain visible coverage gaps.",
        "The empty catalog, artifact stream, and proposal receipt are consistent with finding no justified new profile, safe artifact, or admissible item requiring downstream work.",
        "No geolocation, territorial change, source reliability judgment, observation, claim, assessment, map product, or report narrative was created."
      ],
      "repairs": [],
      "outcome": "pass"
    }
  ],
  "exceptional_condition": false
}
