{
  "task_id": "task_auto_bc004b743767ecf1",
  "pr_number": 138,
  "rounds": [
    {
      "round": 1,
      "reviewed_at": "2026-08-06T09:13:10Z",
      "reviewer_run_id": "run_20260806T091300Z_continuous_loop",
      "checks": [
        "scope",
        "provenance",
        "deduplication",
        "temporal_precision",
        "safety",
        "tests",
        "coverage_gaps",
        "workflow_permissions",
        "dispatch_targets",
        "dispatch_order",
        "non_recursion",
        "queue_receipt"
      ],
      "findings": [
        "The finalizer grants actions: write alongside its existing repository write permissions.",
        "Successful finalization dispatches reconcile-queue.yml and deploy-pages.yml on main after the trusted finalization push.",
        "The finalizer does not dispatch finalize-task-merge.yml and therefore does not introduce a direct recursive loop.",
        "The changed paths are limited to the task manifest, workflow, regression test, queue proposal receipt, and this self-review receipt.",
        "No data-plane provenance, duplicate records, temporal evidence semantics, or sensitive content are changed.",
        "The prior implementation head passed repository validation; the only subsequent failure was the receipt's missing mandatory check names."
      ],
      "repairs": [
        "Added the missing mandatory two-round self-review receipt required by the task definition of done.",
        "Aligned both rounds with every check required by config/autonomy.json."
      ],
      "outcome": "pass"
    },
    {
      "round": 2,
      "reviewed_at": "2026-08-06T09:13:12Z",
      "reviewer_run_id": "run_20260806T091300Z_continuous_loop",
      "checks": [
        "scope",
        "provenance",
        "deduplication",
        "temporal_precision",
        "safety",
        "tests",
        "coverage_gaps",
        "fresh_complete_diff",
        "definition_of_done",
        "workflow_dispatch_support",
        "path_scope",
        "downstream_behavior"
      ],
      "findings": [
        "Both target workflows expose workflow_dispatch and require no dispatch inputs.",
        "The regression test enforces Actions write permission, both target workflow names, dispatch order after the main push, and absence of self-dispatch.",
        "No report, evidence, merge-eligibility, worker direct-merge policy, provenance chain, duplicate record, or evidence timestamp is changed.",
        "The queue proposal receipt explicitly records an empty downstream proposal set and the coverage gaps describe remaining platform assumptions.",
        "All task-specific and autonomy-wide definition-of-done checks are represented in the final diff."
      ],
      "repairs": [],
      "outcome": "pass"
    }
  ],
  "exceptional_condition": false
}
