{
  "task_id": "task_daily_20260805_90_snapshot",
  "pr_number": 136,
  "rounds": [
    {
      "round": 1,
      "reviewed_at": "2026-08-06T08:55:00Z",
      "reviewer_run_id": "run_20260806T084100Z_continuous_loop",
      "checks": [
        "scope",
        "provenance",
        "deduplication",
        "temporal_precision",
        "safety",
        "tests",
        "coverage_gaps",
        "frozen_input_integrity",
        "claim_strength",
        "public_style",
        "manifest_consistency"
      ],
      "findings": [
        "The material diff is limited to the task manifest and its four declared output paths: the report manifest, public Markdown, translation proposal receipt, and self-review receipt.",
        "The report manifest and task repeat the exact sorted frozen set of three approved claims, one approved assessment, and claim-set SHA-256 331a1434a9983e0cad38747806c62466b0c995189695e2b2d4e7276be678aa75.",
        "Public prose states only the Guardian attribution events and the assessment's verification limit; it does not present the underlying presidential statements as independently confirmed.",
        "Publication, reporting-period, assessment, and generation times remain distinct and the public report covers only 5 August 2026 UTC.",
        "The Markdown contains no internal identifiers, hashes, task states, queue terminology, precise operational locations, or targeting-enabling detail.",
        "The Russian translation proposal is dependency-linked, bounded to translation paths, and prohibits factual or analytical changes before the English merge SHA is available.",
        "Validate repository contracts run 31086834035 and Build static publication site run 31086833811 passed on the material report head."
      ],
      "repairs": [],
      "outcome": "pass"
    },
    {
      "round": 2,
      "reviewed_at": "2026-08-06T08:56:00Z",
      "reviewer_run_id": "run_20260806T084100Z_continuous_loop",
      "checks": [
        "scope",
        "provenance",
        "deduplication",
        "temporal_precision",
        "safety",
        "tests",
        "coverage_gaps",
        "fresh_complete_diff",
        "frozen_input_integrity",
        "manifest_content_alignment",
        "definition_of_done"
      ],
      "findings": [
        "A fresh complete-diff pass found one English daily report manifest, one reader-facing English report, one bounded downstream translation proposal, this two-round review receipt, and the task lifecycle update only.",
        "Report ID, language, UTC period, as-of time, content path, approved status, claim IDs, assessment ID, and deterministic hash align across the task and manifest.",
        "The three approved inputs share one Guardian article lineage and are presented as media attributions rather than independent corroboration of three primary publications.",
        "The unresolved-question section preserves the missing stable primary-publication identity and probable status without introducing later verification research.",
        "Coverage gaps are confined to the frozen input set, later-edited Guardian page, absent immutable artifact, and absence of other approved inputs; they do not claim exhaustive internet coverage.",
        "No PR comments, review submissions, or unresolved review threads were present during the fresh review.",
        "The bounded task satisfies its definition of done and no exceptional condition remains."
      ],
      "repairs": [],
      "outcome": "pass"
    }
  ],
  "exceptional_condition": false
}
