{
  "task_id": "task_daily_20260805_80_report_inputs",
  "pr_number": 127,
  "rounds": [
    {
      "round": 1,
      "reviewed_at": "2026-08-06T07:29:10Z",
      "reviewer_run_id": "run_20260806T072900Z_repair",
      "checks": [
        "scope",
        "provenance",
        "deduplication",
        "temporal_precision",
        "safety",
        "tests",
        "coverage_gaps",
        "claim_strength",
        "evidence_independence",
        "assessment_consistency",
        "editorial_status",
        "schema_conformance"
      ],
      "findings": [
        "All task outputs remain within the manifest's declared glob paths and mandatory receipt paths.",
        "The 4 August 21:20 UTC municipal post was removed from approved 5 August report inputs because its observation has no event time establishing overlap with the frozen UTC window.",
        "Four approved claims now describe only directly evidenced publication or attribution events, with event_time set to their source publication minutes inside the frozen window.",
        "Four separate object-level claims remain in_review: the casualty totals are unverified and the three presidential statement claims are probable but lack frozen primary evidence.",
        "Both approved assessments reference only approved reporting-event claims and explicitly exclude the unapproved object-level claims from report inputs.",
        "Two narrow follow-up proposals record the casualty-corroboration and primary-statement coverage gaps."
      ],
      "repairs": [
        "Removed the out-of-window emergency-response claim and its assessment use.",
        "Split reporting-event propositions from object-level propositions.",
        "Changed reporting-event outcomes to confirmed and kept unsupported object-level records unapproved.",
        "Replaced day-wide inferred event times with exact source publication times or null.",
        "Added targeted follow-up proposals."
      ],
      "outcome": "pass"
    },
    {
      "round": 2,
      "reviewed_at": "2026-08-06T07:29:12Z",
      "reviewer_run_id": "run_20260806T072900Z_repair",
      "checks": [
        "scope",
        "provenance",
        "deduplication",
        "temporal_precision",
        "safety",
        "tests",
        "coverage_gaps",
        "fresh_complete_diff",
        "claim_strength",
        "evidence_independence",
        "assessment_consistency",
        "editorial_status",
        "definition_of_done"
      ],
      "findings": [
        "A fresh complete review found eight claims: four approved reporting-event records and four unapproved object-level records.",
        "Every evidence reference resolves to one of the four merged observations used by this task, and every approved assessment references only approved claims.",
        "No approved claim has an event time outside the frozen 5 August UTC window.",
        "Unsupported casualty totals and unfrozen primary presidential statements remain unapproved and are documented through assessments and follow-up proposals.",
        "The generated and reviewed timestamps reflect this repair run and precede the commits that persist the final files.",
        "No sensitive geodata, targeting-enabling detail, unsupported causality, or forecast was introduced."
      ],
      "repairs": [],
      "outcome": "pass"
    }
  ],
  "exceptional_condition": false
}
