{
  "task_id": "task_auto_fa8bc1c2447a3555",
  "pr_number": 135,
  "rounds": [
    {
      "round": 1,
      "reviewed_at": "2026-08-06T08:11:10Z",
      "reviewer_run_id": "run_20260806T081110Z_zelenskyy_review_1",
      "checks": [
        "scope",
        "provenance",
        "deduplication",
        "temporal_precision",
        "safety",
        "tests",
        "coverage_gaps",
        "claim_strength",
        "primary_source_access",
        "supersession_lineage"
      ],
      "findings": [
        "Guardian, Reuters, AP, the Times, and other same-day reports explicitly quote or describe a presidential social-media statement about ballistic interceptors and delivery delays.",
        "The reports are compatible but appear to derive from the same primary Telegram publication, so they are not treated as independent primary corroboration.",
        "No exact Telegram post ID, machine-readable primary timestamp, or matching presidential-site transcript was frozen.",
        "The sanctions wording is less broadly reproduced than the interceptor appeal."
      ],
      "repairs": [
        "Created three distinct verification claims that supersede the earlier object-level claims without modifying the approved Guardian attribution records.",
        "Left all three verification claims and assessments in review with null event times.",
        "Recorded an explicit empty proposal receipt because another unrestricted platform search would not add a narrower actionable duty."
      ],
      "outcome": "pass"
    },
    {
      "round": 2,
      "reviewed_at": "2026-08-06T08:11:20Z",
      "reviewer_run_id": "run_20260806T081120Z_zelenskyy_review_2",
      "checks": [
        "scope",
        "provenance",
        "deduplication",
        "temporal_precision",
        "safety",
        "tests",
        "coverage_gaps",
        "fresh_complete_diff",
        "assessment_consistency",
        "report_input_exclusion",
        "definition_of_done"
      ],
      "findings": [
        "A fresh diff confirms no primary presidential statement claim or assessment is approved.",
        "All three assessments separately match their propositions and preserve the stronger evidence for the interceptor appeal versus the sanctions wording.",
        "The approved Guardian attribution claims remain unchanged and are not conflated with the unresolved object-level statements.",
        "No exact publication time, article artifact, private content, operational position, or targeting-enabling detail was invented or persisted."
      ],
      "repairs": [],
      "outcome": "pass"
    }
  ],
  "exceptional_condition": false
}
