{
  "task_id": "task_backfill_20260805_04_ru_milbloggers",
  "pr_number": 119,
  "rounds": [
    {
      "round": 1,
      "reviewed_at": "2026-08-06T06:06:00Z",
      "reviewer_run_id": "run_20260806T060600Z_rumb04_review1",
      "checks": [
        "scope",
        "provenance",
        "deduplication",
        "temporal_precision",
        "safety",
        "tests",
        "coverage_gaps"
      ],
      "findings": [
        "The material result is limited to the task manifest, four declared discovery outputs, the exact task-specific proposal receipt, and this exact task-specific self-review receipt.",
        "One source item was admitted: Rybar Telegram message 82240. Its canonical URL, platform identifier, explicit calendar-date heading, displayed preview time, retrieval time, language, access method, and aggregation lineage are recorded.",
        "The item uses day precision and full-day bounds because the Telegram preview did not expose a timezone-bearing datetime; the raw manifest explicitly labels exact inclusion after 05:00 UTC as uncertain.",
        "Previously registered messages 82206, 120685, 120697, and 220938 are explicitly excluded as duplicates from the earlier campaign.",
        "The dated Rybar digest was retained only as an aggregator publication; no underlying strike, frontline, or territorial assertion was extracted as fact or promoted to a claim.",
        "Dva Majors route frequencies, infrastructure reporting, launch media, RVvoenkor named-target reporting, and Colonelcassad strike geometry or tactical media were withheld.",
        "Repository validation run 31076068223 passed the test suite and all repository contract validators on the pre-review material head."
      ],
      "repairs": [],
      "outcome": "pass"
    },
    {
      "round": 2,
      "reviewed_at": "2026-08-06T06:07:00Z",
      "reviewer_run_id": "run_20260806T060700Z_rumb04_review2",
      "checks": [
        "scope",
        "provenance",
        "deduplication",
        "temporal_precision",
        "safety",
        "tests",
        "coverage_gaps"
      ],
      "findings": [
        "A fresh independent pass confirmed that every changed path is either declared by the immutable task contract or is an exact task-specific derived proposal or review receipt.",
        "The source-item record and raw-manifest entry agree on item identity, canonical URL, date precision, retrieval time, publication basis, quote locator, and unresolved upstream lineage.",
        "The visible Rybar video digest 82238 was not duplicated because it substantially overlaps the later dated daily chronicle and points to external video.",
        "Out-of-topic, fundraising, official-relay, low-information, map, impact-video, named-target, route, and tactical candidates remain excluded with explicit reasons.",
        "The bounded four-channel result is not described as exhaustive, and Telegram rolling-window, edit-history, timezone, and upstream-lineage limitations remain visible.",
        "No binary artifact, map geometry, precise position, movement route, target coordinate, vulnerable-facility detail, truth assessment, territorial conclusion, observation, claim, or report narrative was created.",
        "No unresolved material defect remains after the separate scope, provenance, deduplication, temporal, safety, validation, and coverage-gap review."
      ],
      "repairs": [],
      "outcome": "pass"
    }
  ],
  "exceptional_condition": false
}
